{
  "$schema": "http://json-schema.org/draft-07/schema#",
  "title": "CitadelReport",
  "type": "object",
  "properties": {
    "sessionId": {
      "type": "string"
    },
    "schema": {
      "type": "string",
      "const": "citadel-report"
    },
    "schemaVersion": {
      "type": "string",
      "const": "1.1"
    },
    "overall": {
      "enum": [
        "PASS",
        "FAIL",
        "WARN"
      ]
    },
    "findings": {
      "type": "array",
      "items": {
        "type": "object",
        "properties": {
          "severity": {
            "enum": [
              "CRITICAL",
              "HIGH",
              "MED",
              "LOW"
            ]
          },
          "category": {
            "type": "string"
          },
          "message": {
            "type": "string"
          },
          "evidence": {
            "type": "string"
          },
          "id": {
            "type": "string"
          },
          "acId": {
            "type": "string"
          },
          "file": {
            "type": "string"
          },
          "line": {
            "type": "number"
          }
        },
        "required": [
          "severity",
          "category",
          "message"
        ]
      }
    },
    "summary": {
      "type": "object",
      "properties": {
        "acsTotal": {
          "type": "number"
        },
        "acsCovered": {
          "type": "number"
        },
        "acsImplemented": {
          "type": "number"
        },
        "acsTested": {
          "type": "number"
        },
        "contractsChecked": {
          "type": "number"
        },
        "trapDoorsFound": {
          "type": "number"
        },
        "filesTouched": {
          "type": "number"
        },
        "critical": {
          "type": "number"
        },
        "high": {
          "type": "number"
        },
        "med": {
          "type": "number"
        },
        "low": {
          "type": "number"
        }
      }
    }
  },
  "required": [
    "sessionId",
    "schema",
    "schemaVersion",
    "overall",
    "findings",
    "summary"
  ]
}